column_name,data_type,description,example
protein_id,TEXT,"The STRING protein identifier for the specific protein.",ENSP00000265371
cog_id,TEXT,"The Cluster of Orthologous Groups (COG) identifier.",NOG06579
root,REAL,"The numerical ID representing the last common ancestor (LCA) or root clade.",23.00
clade_name,TEXT,"The descriptive name of the root clade.",Ambulacraria
preferred_name,TEXT,"The common gene name (e.g., HGNC symbol) used for querying. This is the PRIMARY KEY.",NRP1
ssp_id,REAL,"The NCBI Taxonomy ID for the species of the protein.",9606.00